{
  "accepted_index_checksum": 10958991538947234099,
  "adapter_contract_version": "fastlio2-readonly-observation-v3",
  "bag_sha256": "272325265978787c838e010b1f0da963a15fb4b08ff8730fc3dd9901e32a0e20",
  "binary_record_checksum": 3199404521627026268,
  "checksum_algorithm": "FNV1A64_EXACT_BYTES_V1",
  "config_bundle_sha256": "d5d4262c2489d99d578ff0fae34250aaca4c0c65223cf7fef1db60f42d681e2d",
  "detector_jacobian_checksum": 9219965011477262746,
  "detector_jacobian_column_count": 6,
  "detector_pose_jacobian_rows": [
    [
      -2.900357489346643,
      0.34307498991088803,
      -5.651598659201968,
      -0.48008882999420166,
      -0.8758733868598938,
      0.048585791140794754
    ],
    [
      -2.794996054142875,
      0.600302280317996,
      -5.608137702373465,
      -0.3602093756198883,
      -0.9325814247131348,
      0.02326224371790886
    ],
    [
      -2.7893305886173207,
      0.3082724842628881,
      -5.480750974546708,
      -0.4249832034111023,
      -0.9037570357322693,
      0.05111199989914894
    ],
    [
      -2.0214576369415833,
      1.4810409425930218,
      -5.626995031461931,
      -0.4828280210494995,
      -0.8633338212966919,
      -0.14673693478107452
    ],
    [
      -2.0794966495284353,
      0.9415026820772612,
      -5.74350080779096,
      -0.483582079410553,
      -0.86863774061203,
      -0.10778171569108963
    ],
    [
      -2.76842717195015,
      0.5964704349753243,
      -5.551669853178428,
      -0.3602093756198883,
      -0.9325814247131348,
      0.02326224371790886
    ],
    [
      -2.476216663646275,
      0.4930511057354021,
      -5.14755031851523,
      -0.5145950317382812,
      -0.8573775887489319,
      0.009780989028513432
    ],
    [
      -1.8139638912175464,
      2.5376439235708066,
      -5.02807455789297,
      -0.3577001988887787,
      -0.8978344202041626,
      -0.25679558515548706
    ],
    [
      -1.7845183031637057,
      1.1875420205514424,
      -5.647646920108006,
      -0.470242977142334,
      -0.8673892021179199,
      -0.16281156241893768
    ],
    [
      -1.7692847770721483,
      1.096219835303446,
      -5.768604449991643,
      -0.470242977142334,
      -0.8673892021179199,
      -0.16281156241893768
    ],
    [
      -1.6932722441262256,
      -0.15874507875138644,
      -3.186532381696411,
      -0.34763103723526,
      -0.9294615983963013,
      0.12350615113973618
    ],
    [
      -1.0418172736261933,
      1.420321579172446,
      -2.4637142502864116,
      -0.481189101934433,
      -0.8527610301971436,
      -0.20311503112316132
    ],
    [
      -0.9782116007162353,
      -0.25176396523446787,
      -1.8772197456209483,
      -0.5349469780921936,
      -0.8368620872497559,
      0.11616168916225433
    ],
    [
      1.7960338622628247,
      2.9574313076764005,
      3.346867358523957,
      -0.77362060546875,
      0.2032555490732193,
      -0.6001652479171753
    ],
    [
      -0.9962690441860714,
      0.22613931850993896,
      -1.76676758463815,
      -0.41505515575408936,
      -0.9079508781433105,
      0.05791698768734932
    ],
    [
      -0.8138409614819343,
      -3.081108068038815,
      -2.527092382227962,
      -0.09683617949485779,
      -0.7018244862556458,
      0.705737292766571
    ],
    [
      -2.22043274116929,
      -0.7073631579747655,
      -7.094434312084042,
      -0.3731825649738312,
      -0.9277070760726929,
      -0.009710991755127907
    ],
    [
      2.661165977701057,
      5.784062684456012,
      -0.1204333971935383,
      -0.012832301668822765,
      0.04774393141269684,
      -0.9987772107124329
    ],
    [
      2.7404289636756753,
      5.993251719643384,
      0.04763992937521966,
      -0.0010751483496278524,
      0.0734761506319046,
      -0.9972964525222778
    ],
    [
      -3.3285065694520455,
      -4.419781703532003,
      -4.787479528614562,
      -0.2597641944885254,
      -0.7687861919403076,
      0.5843718647956848
    ],
    [
      -3.3373653578857905,
      -4.659003475010396,
      -4.32478604049737,
      -0.3825345039367676,
      -0.7202385067939758,
      0.5787259936332703
    ],
    [
      2.5037625689588,
      5.899028654974937,
      -0.02419518948252264,
      -0.0128323370590806,
      0.047743622213602066,
      -0.9987772107124329
    ],
    [
      -0.9997016643874479,
      -1.4718405550063574,
      -0.9327530809551586,
      -0.6489099860191345,
      -0.5645376443862915,
      0.5101109147071838
    ],
    [
      -0.919610589543686,
      0.878586146943753,
      -2.5069354905359007,
      -0.4818507730960846,
      -0.8592938184738159,
      -0.17156310379505157
    ],
    [
      -0.9912272756295183,
      1.2777677142898827,
      -2.518606242823505,
      -0.4811890721321106,
      -0.8527610898017883,
      -0.20311513543128967
    ],
    [
      0.36519333446453794,
      6.110958528646017,
      -0.11004913743082104,
      -0.08496739715337753,
      -0.18979953229427338,
      -0.9781394004821777
    ],
    [
      -0.8037608692190943,
      0.6887718381685455,
      -1.7703082156450263,
      -0.49295857548713684,
      -0.8623486757278442,
      -0.11552784591913223
    ],
    [
      -0.6514667177737121,
      0.3751369483711888,
      -1.1998253350837642,
      -0.45465120673179626,
      -0.8901929259300232,
      -0.0291359294205904
    ],
    [
      -2.1339249289759135,
      -1.506034055155849,
      -7.202488454590204,
      -0.45939433574676514,
      -0.8882321119308472,
      -0.0007416066946461797
    ],
    [
      -2.0197199573123963,
      -0.9157971658178343,
      -7.134765747455166,
      -0.371915727853775,
      -0.9280974864959717,
      -0.017712973058223724
    ],
    [
      -2.1066595677398188,
      -1.3416120976872157,
      -7.306828104723628,
      -0.39728793501853943,
      -0.917673647403717,
      0.006105148233473301
    ],
    [
      -1.7614779031366985,
      -1.0724085805376893,
      -6.007774275492385,
      -0.44335538148880005,
      -0.8962811827659607,
      -0.010772847570478916
    ],
    [
      -1.9168850536028357,
      -1.3335435820722188,
      -6.320521725266358,
      -0.4433899521827698,
      -0.8962381482124329,
      0.01275258045643568
    ],
    [
      2.565718213017173,
      5.504306957161529,
      -0.11939150398751286,
      -0.03555414080619812,
      0.04424251988530159,
      -0.9983879327774048
    ],
    [
      -1.6769667597460807,
      -0.8301876478579189,
      -5.985579404635533,
      -0.3903639316558838,
      -0.9204192161560059,
      -0.02108442410826683
    ],
    [
      2.299320313438616,
      5.434241587139096,
      -0.2948929731054193,
      -0.026377864181995392,
      0.0015690854052081704,
      -0.999650776386261
    ],
    [
      2.53349873777122,
      5.782254960055192,
      -0.06090912372693669,
      -0.012832339853048325,
      0.04774364084005356,
      -0.9987772107124329
    ],
    [
      -1.2357904836441371,
      -0.8471492268711163,
      -4.246967473627122,
      -0.5687132477760315,
      -0.8204973340034485,
      -0.05787381902337074
    ],
    [
      -1.3562352437974705,
      -0.48330853452731737,
      -5.1790212749884015,
      -0.4542163014411926,
      -0.8872411847114563,
      -0.08056408911943436
    ],
    [
      1.7503303476881213,
      4.977342023643551,
      0.2018068589623757,
      -0.07254008203744888,
      0.0362006314098835,
      -0.9967082738876343
    ],
    [
      1.7498818380491525,
      5.0920779528406355,
      0.7634192621514092,
      -0.06473396718502045,
      0.13087622821331024,
      -0.98928302526474
    ],
    [
      -1.131867222749446,
      0.0971698680638271,
      -3.131673164692357,
      -0.38360029458999634,
      -0.9225860834121704,
      -0.041057437658309937
    ],
    [
      -0.6130042285236404,
      -0.07607590078668558,
      -1.8621073074027423,
      -0.48368313908576965,
      -0.8735606670379639,
      -0.054244011640548706
    ],
    [
      -0.692989678761241,
      0.7493538668296467,
      -1.7033564492982731,
      -0.35547152161598206,
      -0.9136123657226562,
      -0.19736385345458984
    ],
    [
      -0.46645240522725523,
      0.43742847340854196,
      -1.253610134209496,
      -0.460006982088089,
      -0.8714892864227295,
      -0.1699998378753662
    ],
    [
      -0.48596123483727327,
      -0.1374012384912282,
      -1.4366588851296822,
      -0.4186798632144928,
      -0.9081190228462219,
      -0.005202838219702244
    ],
    [
      -0.7092186215593228,
      0.7840401911258154,
      -1.6730498030320922,
      -0.3554716110229492,
      -0.9136123061180115,
      -0.19736383855342865
    ],
    [
      0.4346908201083977,
      -0.5693863536533126,
      0.4666269947563022,
      -0.6432104110717773,
      -0.7607325315475464,
      0.08698450773954391
    ],
    [
      -0.21179228029225827,
      0.07894213348956147,
      -0.5058238626720386,
      -0.46361809968948364,
      -0.8840485215187073,
      -0.05929989740252495
    ],
    [
      -0.2818564009919444,
      0.06683735106187871,
      -0.615018674204777,
      -0.35963183641433716,
      -0.9330780506134033,
      -0.005492927972227335
    ],
    [
      -2.065360123751059,
      -1.3025910448010856,
      -7.829572614481613,
      -0.43029648065567017,
      -0.9019720554351807,
      -0.03593483567237854
    ],
    [
      -2.0762551245989136,
      -1.5850430236175181,
      -8.38144030606474,
      -0.3729877769947052,
      -0.9277339577674866,
      -0.013776668347418308
    ],
    [
      -1.926865921210548,
      -1.6331680602585052,
      -7.471888961037286,
      -0.43251022696495056,
      -0.9014795422554016,
      -0.016421524807810783
    ],
    [
      -1.940720311999708,
      -1.8069354210536188,
      -7.56385962858396,
      -0.45130759477615356,
      -0.8922127485275269,
      -0.016671985387802124
    ],
    [
      -1.9744019814489087,
      -1.804470258326537,
      -6.656819880911771,
      -0.44403350353240967,